word,definition,part_of_speech,example
maçã,Uma fruta redonda com casca vermelha ou verde e interior esbranquiçado.,substantivo,Eu comi uma maçã deliciosa no café da manhã.
carro,"Um veículo rodoviário, normalmente com quatro rodas, movido por um motor de combustão interna.",substantivo,Ela dirige o carro para o trabalho todos os dias.
laranja,Laranja,Substantivo,Essa laranja está azeda!
análise,"Análise consiste no exame detalhado sobre determinada matéria ou assunto, observando todos os pormenores que formam cada parte de um todo",Substantivo,Terminou a análise que o chefe pediu?
visualização,Visualização é uma métrica usada para mensurar o potencial de alcance de divulgações em canais,Substantivo,Quantas visualizações a página de liderança teve?
roxo,roxo é a cor do meu pau,adjetivo,meu pau é roxo
